{
  "meta": {
    "schema_version": "special_points_spec_v1",
    "timestamp_utc": "2025-11-25T12:00:00Z",
    "jd_utc": 2453303.125,
    "ayanamsa_deg": 23.924
  },
  "person": {
    "id": "mehran",
    "label": "Mehran",
    "birth_date": "1997-06-07",
    "birth_time": "20:28:36",
    "timezone": "Asia/Tehran"
  },
  "config_echo": {
    "zodiac_type": "SIDEREAL",
    "ayanamsa_mode": "LAHIRI",
    "house_system": "5"
  },
  "frames": {
    "special_lagnas": [
      {
        "id": "BHAVA_LAGNA",
        "name": "Bhava Lagna",
        "longitude_deg": 245.67,
        "degree_in_sign": 25.67,
        "sign_index": 9,
        "sign_name": "SAGITTARIUS",
        "nakshatra_index": 20,
        "nakshatra_name": "POORAADAM",
        "nakshatra_pada": 3
      },
      {
        "id": "HORA_LAGNA",
        "name": "Hora Lagna",
        "longitude_deg": 89.12,
        "degree_in_sign": 29.12,
        "sign_index": 3,
        "sign_name": "CANCER",
        "nakshatra_index": 8,
        "nakshatra_name": "POOSAM",
        "nakshatra_pada": 4
      },
      {
        "id": "GHATI_LAGNA",
        "name": "Ghati Lagna",
        "longitude_deg": 156.23,
        "degree_in_sign": 6.23,
        "sign_index": 6,
        "sign_name": "VIRGO",
        "nakshatra_index": 12,
        "nakshatra_name": "UTHIRAM",
        "nakshatra_pada": 3
      },
      {
        "id": "SREE_LAGNA",
        "name": "Sree Lagna",
        "longitude_deg": 312.45,
        "degree_in_sign": 12.45,
        "sign_index": 11,
        "sign_name": "AQUARIUS",
        "nakshatra_index": 24,
        "nakshatra_name": "SADAYAM",
        "nakshatra_pada": 2
      }
    ]
  }
}
